{
    "$schema": "http://json-schema.org/draft-07/schema#",
    "title": "Experience",
    "type": "array",
    "items": {
      "type": "object",
      "required": ["role", "company", "period", "description", "highlights"],
      "properties": {
        "role": {
          "type": "string",
          "description": "Job title or role"
        },
        "company": {
          "type": "string",
          "description": "Company or organization name"
        },
        "period": {
          "type": "string",
          "description": "Time period of employment",
          "pattern": "^\\d{4}( - (Present|\\d{4}))$"
        },
        "description": {
          "type": "string",
          "description": "Brief description of the role"
        },
        "highlights": {
          "type": "array",
          "items": {
            "type": "string"
          },
          "description": "Key achievements and responsibilities"
        }
      }
    }
  }